{
  "claim_status": "DO_NOT_PROMOTE",
  "falsification": [
    "Any required arm missing on same split -> no public superiority claim",
    "Primary metric delta <= 0 vs any required baseline -> fail claim",
    "Permutation null p-value > threshold -> fail claim",
    "Top-degree leverage drop above threshold -> fail claim"
  ],
  "gate_pass": false,
  "gates": {
    "leverage_drop_max": 0.03,
    "min_delta_vs_plain": 0.02,
    "p_value_max": 0.05
  },
  "generated_at": "2026-03-08T14:18:45.118068+00:00",
  "headline": {
    "baseline_metrics": {
      "plain_llm": 0.0,
      "plain_llm_rag": 0.4,
      "sham_complexity": 0.2,
      "simple_graph": 0.0
    },
    "best_baseline": 0.4,
    "delta_vs_best_baseline": -0.2,
    "math_governed": 0.2,
    "metric": "accuracy"
  },
  "hypotheses": [
    "H1: math_governed > plain_llm on out-of-sample public tasks",
    "H2: math_governed > plain_llm_rag on same split and budget",
    "H3: math_governed > sham_complexity on same split and budget"
  ],
  "leverage_audit": {
    "degree_cutoff_90pct": 1.0,
    "delta_drop": 0.0,
    "delta_full": -0.2,
    "delta_without_top_degree": -0.2,
    "pass": false
  },
  "negative_result_reporting": true,
  "null_audit": {
    "n_permutations": 200,
    "p_value": 1.0,
    "pass": false
  },
  "report_id": "20260308T141845Z",
  "rows": [
    {
      "arm": "simple_graph",
      "ci_high": 0.0,
      "ci_low": 0.0,
      "metric": "accuracy",
      "n": 5,
      "run_id": "20260308T140548Z_simple_graph",
      "value": 0.0
    },
    {
      "arm": "sham_complexity",
      "ci_high": 0.4,
      "ci_low": 0.0,
      "metric": "accuracy",
      "n": 5,
      "run_id": "20260308T140455Z_sham_complexity",
      "value": 0.2
    },
    {
      "arm": "math_governed",
      "ci_high": 0.4,
      "ci_low": 0.0,
      "metric": "accuracy",
      "n": 5,
      "run_id": "20260308T140355Z_math_governed",
      "value": 0.2
    },
    {
      "arm": "plain_llm_rag",
      "ci_high": 0.8,
      "ci_low": 0.0,
      "metric": "accuracy",
      "n": 5,
      "run_id": "20260308T140246Z_plain_llm_rag",
      "value": 0.4
    },
    {
      "arm": "plain_llm",
      "ci_high": 0.0,
      "ci_low": 0.0,
      "metric": "accuracy",
      "n": 5,
      "run_id": "20260308T140137Z_plain_llm",
      "value": 0.0
    }
  ],
  "scope": "benchmark-in-progress",
  "source_workspace": "/Users/aaronvick/Downloads/aboutmoxie/Reflective_Samples_Org/outputs/orgbench_real_local"
}